{
  "$schema": "./schema.json",
  "description": "AMBIGUOUS (A4): no Content-Type header with a valid JSON body: 415 unsupported_media_type",
  "contract": "ADR-0008 Changes 2026-10-28 H4; spec §8 (Content-Type: application/json)",
  "setup": {
    "token": "valid",
    "project": {
      "slug": "demo-app",
      "privacy_class": "L0"
    },
    "preload": [],
    "otherProjects": [],
    "requestsAlreadyInWindow": 0
  },
  "request": {
    "method": "POST",
    "path": "/api/v1/events",
    "headers": {},
    "gzip": false,
    "body": {
      "events": [
        {
          "jgr": "0.1",
          "event_id": "01JBZ4XQ800000000000033001",
          "producer_id": "prod_claude-code_7f3a",
          "project_ref": "$PROJECT_SLUG",
          "thread_ref": "s_0123456789abcdef0123456789abcdef",
          "sequence": 1,
          "type": "heartbeat",
          "status": "working",
          "occurred_at": "$NOW-30s"
        }
      ]
    },
    "rawBody": null,
    "bodyPadBytes": null
  },
  "expect": {
    "status": 415,
    "headers": {},
    "errorCode": "unsupported_media_type",
    "accepted": null,
    "duplicates": null,
    "rejected": null,
    "lastSignal": null,
    "equivalenceGroup": null
  }
}
