{
  "$schema": "./schema.json",
  "description": "project_ref is another workspace project's slug: rejected with project_mismatch (the token fixes the project)",
  "contract": "ADR-0008 Decision outcome (Tenant rules: \"the token fixes the project\"); spec §13",
  "setup": {
    "token": "valid",
    "project": {
      "slug": "demo-app",
      "privacy_class": "L0"
    },
    "preload": [],
    "otherProjects": [
      {
        "slug": "other-app",
        "privacy_class": "L0",
        "preload": []
      }
    ],
    "requestsAlreadyInWindow": 0
  },
  "request": {
    "method": "POST",
    "path": "/api/v1/events",
    "headers": {
      "content-type": "application/json"
    },
    "gzip": false,
    "body": {
      "events": [
        {
          "jgr": "0.1",
          "event_id": "01JBZ4XQ800000000000020001",
          "producer_id": "prod_claude-code_7f3a",
          "project_ref": "$PROJECT_SLUG",
          "thread_ref": "s_0123456789abcdef0123456789abcdef",
          "sequence": 1,
          "type": "heartbeat",
          "status": "working",
          "occurred_at": "$NOW-30s"
        },
        {
          "jgr": "0.1",
          "event_id": "01JBZ4XQ800000000000020002",
          "producer_id": "prod_claude-code_7f3a",
          "project_ref": "other-app",
          "thread_ref": "s_0123456789abcdef0123456789abcdef",
          "sequence": 2,
          "type": "heartbeat",
          "status": "working",
          "occurred_at": "$NOW-30s"
        }
      ]
    },
    "rawBody": null,
    "bodyPadBytes": null
  },
  "expect": {
    "status": 202,
    "headers": {},
    "errorCode": null,
    "accepted": 1,
    "duplicates": 0,
    "rejected": [
      {
        "index": 1,
        "event_id": "01JBZ4XQ800000000000020002",
        "codes": ["project_mismatch"]
      }
    ],
    "lastSignal": null,
    "equivalenceGroup": null
  }
}
