{
  "$schema": "./schema.json",
  "description": "Spec-valid L2 event sent to an L1 project: rejected with privacy_class_not_allowed",
  "contract": "ADR-0008 Decision outcome (Tenant rules: L0 < L1 < L2 ceiling); spec §7, §13",
  "setup": {
    "token": "valid",
    "project": {
      "slug": "demo-app",
      "privacy_class": "L1"
    },
    "preload": [],
    "otherProjects": [],
    "requestsAlreadyInWindow": 0
  },
  "request": {
    "method": "POST",
    "path": "/api/v1/events",
    "headers": {
      "content-type": "application/json"
    },
    "gzip": false,
    "body": {
      "events": [
        {
          "jgr": "0.1",
          "event_id": "01JBZ4XQ800000000000023001",
          "producer_id": "prod_claude-code_7f3a",
          "project_ref": "$PROJECT_SLUG",
          "thread_ref": "s_0123456789abcdef0123456789abcdef",
          "sequence": 1,
          "type": "task.completed",
          "status": "completed",
          "occurred_at": "$NOW-30s",
          "privacy_class": "L2",
          "encrypted": {
            "alg": "A256GCM",
            "kid": "user-key-1",
            "iv": "AAAAAAAAAAAAAAAAAAAAAA",
            "ciphertext": "c2VjcmV0LWNvbnRlbnQ"
          }
        }
      ]
    },
    "rawBody": null,
    "bodyPadBytes": null
  },
  "expect": {
    "status": 202,
    "headers": {},
    "errorCode": null,
    "accepted": 0,
    "duplicates": 0,
    "rejected": [
      {
        "index": 0,
        "event_id": "01JBZ4XQ800000000000023001",
        "codes": ["privacy_class_not_allowed"]
      }
    ],
    "lastSignal": null,
    "equivalenceGroup": null
  }
}
