{
  "$schema": "./schema.json",
  "description": "project_ref = the project id (not the slug) is accepted",
  "contract": "ADR-0008 Decision outcome (Tenant rules: \"slug or id\"); spec §3 project_ref",
  "setup": {
    "token": "valid",
    "project": {
      "slug": "demo-app",
      "privacy_class": "L0"
    },
    "preload": [],
    "otherProjects": [],
    "requestsAlreadyInWindow": 0
  },
  "request": {
    "method": "POST",
    "path": "/api/v1/events",
    "headers": {
      "content-type": "application/json"
    },
    "gzip": false,
    "body": {
      "events": [
        {
          "jgr": "0.1",
          "event_id": "01JBZ4XQ800000000000002001",
          "producer_id": "prod_claude-code_7f3a",
          "project_ref": "$PROJECT_ID",
          "thread_ref": "s_0123456789abcdef0123456789abcdef",
          "sequence": 1,
          "type": "heartbeat",
          "status": "working",
          "occurred_at": "$NOW-30s"
        }
      ]
    },
    "rawBody": null,
    "bodyPadBytes": null
  },
  "expect": {
    "status": 202,
    "headers": {},
    "errorCode": null,
    "accepted": 1,
    "duplicates": 0,
    "rejected": [],
    "lastSignal": null,
    "equivalenceGroup": null
  }
}
