{
  "$schema": "./schema.json",
  "description": "Token that was issued and then revoked: 401 with WWW-Authenticate: Bearer",
  "contract": "ADR-0008 Decision outcome (Transport handling: 401 with WWW-Authenticate: Bearer); spec §8",
  "setup": {
    "token": "revoked",
    "project": {
      "slug": "demo-app",
      "privacy_class": "L0"
    },
    "preload": [],
    "otherProjects": [],
    "requestsAlreadyInWindow": 0
  },
  "request": {
    "method": "POST",
    "path": "/api/v1/events",
    "headers": {
      "content-type": "application/json"
    },
    "gzip": false,
    "body": {
      "events": [
        {
          "jgr": "0.1",
          "event_id": "01JBZ4XQ800000000000031001",
          "producer_id": "prod_claude-code_7f3a",
          "project_ref": "$PROJECT_SLUG",
          "thread_ref": "s_0123456789abcdef0123456789abcdef",
          "sequence": 1,
          "type": "heartbeat",
          "status": "working",
          "occurred_at": "$NOW-30s"
        }
      ]
    },
    "rawBody": null,
    "bodyPadBytes": null
  },
  "expect": {
    "status": 401,
    "headers": {
      "www-authenticate": {
        "pattern": "^Bearer(\\s.*)?$"
      }
    },
    "errorCode": null,
    "accepted": null,
    "duplicates": null,
    "rejected": null,
    "lastSignal": null,
    "equivalenceGroup": "events-401"
  }
}
