{
  "$schema": "./schema.json",
  "description": "Upper-case spelling of a stored lower-case UUID is a duplicate",
  "contract": "ADR-0008 Changes 2026-10-28 H1 (UUID lower-case canonical form)",
  "setup": {
    "token": "valid",
    "project": {
      "slug": "demo-app",
      "privacy_class": "L0"
    },
    "preload": [
      {
        "jgr": "0.1",
        "event_id": "0192f0c1-2a3b-7c4d-8e5f-0123456789ab",
        "producer_id": "prod_claude-code_7f3a",
        "project_ref": "$PROJECT_SLUG",
        "thread_ref": "s_0123456789abcdef0123456789abcdef",
        "sequence": 1,
        "type": "heartbeat",
        "status": "working",
        "occurred_at": "$NOW-30s"
      }
    ],
    "otherProjects": [],
    "requestsAlreadyInWindow": 0
  },
  "request": {
    "method": "POST",
    "path": "/api/v1/events",
    "headers": {
      "content-type": "application/json"
    },
    "gzip": false,
    "body": {
      "events": [
        {
          "jgr": "0.1",
          "event_id": "0192F0C1-2A3B-7C4D-8E5F-0123456789AB",
          "producer_id": "prod_claude-code_7f3a",
          "project_ref": "$PROJECT_SLUG",
          "thread_ref": "s_0123456789abcdef0123456789abcdef",
          "sequence": 1,
          "type": "heartbeat",
          "status": "working",
          "occurred_at": "$NOW-30s"
        }
      ]
    },
    "rawBody": null,
    "bodyPadBytes": null
  },
  "expect": {
    "status": 202,
    "headers": {},
    "errorCode": null,
    "accepted": 0,
    "duplicates": 1,
    "rejected": [],
    "lastSignal": null,
    "equivalenceGroup": null
  }
}
