{
  "$schema": "./schema.json",
  "description": "Body {} has no events array: 400",
  "contract": "ADR-0008 Decision outcome (Transport handling: \"batch shape → 400\"); spec §8 body { \"events\": [ ... ] }",
  "setup": {
    "token": "valid",
    "project": {
      "slug": "demo-app",
      "privacy_class": "L0"
    },
    "preload": [],
    "otherProjects": [],
    "requestsAlreadyInWindow": 0
  },
  "request": {
    "method": "POST",
    "path": "/api/v1/events",
    "headers": {
      "content-type": "application/json"
    },
    "gzip": false,
    "body": {},
    "rawBody": null,
    "bodyPadBytes": null
  },
  "expect": {
    "status": 400,
    "headers": {},
    "errorCode": null,
    "accepted": null,
    "duplicates": null,
    "rejected": null,
    "lastSignal": null,
    "equivalenceGroup": null
  }
}
