{
  "$schema": "./schema.json",
  "description": "Valid event + event with an unknown top-level field: valid one stored, other rejected with schema (partial acceptance)",
  "contract": "Spec §3 JGR-R11, §8 (R13 partial acceptance); ADR-0008 Tenant rules (\"per-event rejections inside a 202\")",
  "setup": {
    "token": "valid",
    "project": {
      "slug": "demo-app",
      "privacy_class": "L0"
    },
    "preload": [],
    "otherProjects": [],
    "requestsAlreadyInWindow": 0
  },
  "request": {
    "method": "POST",
    "path": "/api/v1/events",
    "headers": {
      "content-type": "application/json"
    },
    "gzip": false,
    "body": {
      "events": [
        {
          "jgr": "0.1",
          "event_id": "01JBZ4XQ800000000000008001",
          "producer_id": "prod_claude-code_7f3a",
          "project_ref": "$PROJECT_SLUG",
          "thread_ref": "s_0123456789abcdef0123456789abcdef",
          "sequence": 1,
          "type": "heartbeat",
          "status": "working",
          "occurred_at": "$NOW-30s"
        },
        {
          "jgr": "0.1",
          "event_id": "01JBZ4XQ800000000000008002",
          "producer_id": "prod_claude-code_7f3a",
          "project_ref": "$PROJECT_SLUG",
          "thread_ref": "s_0123456789abcdef0123456789abcdef",
          "sequence": 2,
          "type": "heartbeat",
          "status": "working",
          "occurred_at": "$NOW-30s",
          "prompt": "refactor the checkout"
        }
      ]
    },
    "rawBody": null,
    "bodyPadBytes": null
  },
  "expect": {
    "status": 202,
    "headers": {},
    "errorCode": null,
    "accepted": 1,
    "duplicates": 0,
    "rejected": [
      {
        "index": 1,
        "event_id": "01JBZ4XQ800000000000008002",
        "codes": ["schema"]
      }
    ],
    "lastSignal": "advanced",
    "equivalenceGroup": null
  }
}
